{
  "meta": {
    "operation": "Lame",
    "target": "10.129.8.218",
    "date": "2026-03-24",
    "agent": "SOVA v1.0",
    "status": "COMPLETE"
  },
  "target_profile": {
    "ip": "10.129.8.218",
    "hostname": "lame",
    "os_guess": "Linux (Ubuntu, Debian-based) — Samba confirms Unix",
    "os_confidence": "HIGH"
  },
  "ports": [
    {
      "port": 21,
      "protocol": "tcp",
      "state": "open",
      "service": "ftp",
      "version": "vsftpd 2.3.4",
      "version_confidence": "HIGH",
      "notes": "Anonymous login allowed per nmap (code 230). Empty listing. Known backdoored version CVE-2011-2523."
    },
    {
      "port": 22,
      "protocol": "tcp",
      "state": "open",
      "service": "ssh",
      "version": "OpenSSH 4.7p1 Debian 8ubuntu1",
      "version_confidence": "HIGH",
      "notes": "Protocol 2.0. Very old version. DSA and RSA host keys."
    },
    {
      "port": 139,
      "protocol": "tcp",
      "state": "open",
      "service": "netbios-ssn",
      "version": "Samba smbd 3.0.20-Debian",
      "version_confidence": "HIGH",
      "notes": "Workgroup: WORKGROUP"
    },
    {
      "port": 445,
      "protocol": "tcp",
      "state": "open",
      "service": "netbios-ssn",
      "version": "Samba smbd 3.0.20-Debian",
      "version_confidence": "HIGH",
      "notes": "Domain: hackthebox.gr. FQDN: lame.hackthebox.gr. Message signing disabled. SMB2 negotiation failed."
    },
    {
      "port": 3632,
      "protocol": "tcp",
      "state": "open",
      "service": "distccd",
      "version": "distccd v1 (GNU 4.2.4 Ubuntu 4.2.4-1ubuntu4)",
      "version_confidence": "HIGH",
      "notes": "Distributed compiler daemon. CVE-2004-2687 RCE."
    }
  ],
  "web_services": [],
  "file_sharing": [
    {
      "service": "FTP",
      "port": 21,
      "anonymous_access": true,
      "null_session": false,
      "notes": "Anonymous login allowed but empty listing — no files accessible."
    },
    {
      "service": "SMB",
      "port": 445,
      "anonymous_access": true,
      "null_session": true,
      "notes": "Null session exposes shares: print$, tmp (comment: 'oh noes!'), opt, IPC$, ADMIN$."
    }
  ],
  "remote_access": [
    {
      "service": "SSH",
      "port": 22,
      "version": "OpenSSH 4.7p1 Debian 8ubuntu1",
      "auth_methods": ["publickey", "password"],
      "notes": "Very old version. Useful for stable shell after initial access."
    }
  ],
  "other_services": [
    {
      "service": "distccd",
      "port": 3632,
      "notes": "Distributed compiler daemon. No access restriction. CVE-2004-2687 allows RCE as daemon user."
    }
  ],
  "anomalies": [
    {
      "description": "SMB 'tmp' share has comment 'oh noes!' — deliberately exposed, likely writable",
      "location": "SMB share listing",
      "significance": "May be relevant to exploitation — writable share could be used for payload staging"
    }
  ],
  "gaps": [],
  "oracle_recommendations": [
    {
      "priority": 1,
      "action": "Exploit Samba 3.0.20 via CVE-2007-2447 (username map script RCE)",
      "rationale": "Direct root shell. No auth required. Confirmed vulnerable version. Multiple reliable PoCs. Trivial single-command exploit."
    },
    {
      "priority": 2,
      "action": "Test vsftpd 2.3.4 backdoor CVE-2011-2523",
      "rationale": "Would give root if backdoor is active, but frequently non-functional on HTB instances."
    },
    {
      "priority": 3,
      "action": "Exploit distccd CVE-2004-2687 for user shell",
      "rationale": "Reliable RCE but only as low-priv daemon user. Would require separate privesc. Fallback only."
    }
  ],
  "tools_executed": [
    {
      "tool": "sova_full_scan",
      "command": "nmap -p- -sC -sV -T4 10.129.8.218",
      "output_file": "../shared/raw/sova_full_scan_20260324T172439Z.txt"
    },
    {
      "tool": "sova_anon_ftp",
      "command": "curl -s --connect-timeout 10 ftp://anonymous:anonymous@10.129.8.218/",
      "output_file": "../shared/raw/sova_anon_ftp_20260324T172727Z.txt"
    },
    {
      "tool": "sova_null_session",
      "command": "smbclient -N -L //10.129.8.218",
      "output_file": "../shared/raw/sova_null_session_20260324T172728Z.txt"
    }
  ],
  "raw_output_dir": "../shared/raw/"
}
